Id,TitleName,Description,ReleaseYear,Certification,Runtime,ProductionCountry,Seasons
1,placeat,Ut sit corrupti fugit quae doloremque sint et qui numquam.,2005,S,165,KR,9
2,minus,Qui nesciunt ut eum quidem vero.,2005,TVG,91,AF,2
3,quaerat,Adipisci veritatis modi minus et.,2008,GP,117,BJ,
4,qui,Sapiente non accusamus tempora animi quia numquam quo quo.,2012,T,128,LB,
5,adipisci,Deserunt at hic sed.,2009,MA15,120,GB,4
6,a,Culpa recusandae magnam sed at quo beatae mollitia quod.,2020,_12,132,FM,
7,optio,Cumque exercitationem qui.,2004,R21,160,TC,
8,ea,Nam asperiores repellendus quae.,2020,A,95,MY,3
9,ut,Sint blanditiis fuga nesciunt quia amet quos consequatur corrupti.,2012,EC,84,BI,
10,quo,Quis maiores deleniti voluptas placeat ratione.,2017,_15,134,CC,1
11,quo,Sit facilis eos est.,2014,_18R,163,MO,
12,repellat,Recusandae est et.,2017,M,130,AG,6
13,animi,Culpa molestias ea non dolor distinctio.,2021,R18plus,142,UA,
14,aut,Ullam dicta iure nam harum sunt qui ipsam quae iure.,2013,TVPG,135,LA,
15,deleniti,Dolores qui at.,2021,CA,95,ER,
16,corrupti,Debitis facere quia temporibus est.,2007,R18plus,169,GN,
17,inventore,Corporis accusamus aut dolorum et vitae aut.,2005,NC17,145,SA,1
18,aut,Nihil et assumenda et nihil ex accusamus hic dolor.,2020,MPG,89,BM,8
19,fuga,Omnis perspiciatis architecto provident quos quia minus qui.,2022,A,114,BA,
20,harum,Voluptas nulla sequi sit nam est.,2012,_18,104,IL,
21,quia,Et provident amet facere.,2004,C,85,FO,
22,molestiae,Numquam velit impedit nisi rerum doloribus.,2012,U,93,KG,
23,aliquid,Corrupti sint enim ut qui ab et.,2008,R,178,DE,6
24,dolores,Iure amet quis.,2004,EC,97,MR,7
25,molestiae,Adipisci voluptatem mollitia consequuntur fuga sed atque consequatur eaque.,2017,U,124,BA,4
26,ad,Facere atque voluptatem perspiciatis et natus tenetur fuga sapiente deserunt.,2009,R21,106,MV,8
27,impedit,Ipsa nesciunt quidem et.,2009,G,171,SO,1
28,assumenda,Eius incidunt asperiores dicta voluptas consequatur et corrupti.,2017,TVG,71,GR,3
29,dolores,Soluta necessitatibus illum nemo.,2009,A,145,AL,8
30,quia,Recusandae autem unde optio molestiae.,2018,T,117,AO,
31,repudiandae,Eius sit magnam sed molestiae.,2005,AL,108,PN,
32,suscipit,Nobis commodi deleniti.,2021,TVPG,76,AS,2
33,autem,Saepe rerum natus aspernatur fuga et consequuntur et cumque.,2007,C,157,GQ,9
34,autem,Eius iste repellat dolor.,2013,_18R,66,NP,2
35,eum,Fugiat sit autem.,2009,PG13,164,KR,
36,maiores,Quia iure vero aut.,2017,U,67,PF,3
37,dolorem,Fuga iusto id exercitationem sit explicabo.,2021,AL,175,VI,6
38,aut,Explicabo aut mollitia minima error qui eos ut omnis et.,2007,TVG,162,SS,9
39,veniam,Ullam fugit odit placeat nam eveniet.,2010,PG,174,NI,7
40,aspernatur,Blanditiis rerum doloremque ipsam nesciunt minima cumque qui.,2005,TVY7,84,AG,
41,modi,Minima molestiae dicta vero cum quo sunt.,2014,CA,100,IE,
42,aspernatur,Voluptatem culpa assumenda praesentium enim ut neque modi id.,2010,GP,71,NF,4
43,hic,Eos veritatis nesciunt id occaecati vitae saepe nostrum.,2012,E10plus,79,TG,10
44,doloribus,Rerum qui perferendis occaecati assumenda.,2021,CA,75,YE,
45,quo,Rerum consequatur voluptates totam in ex accusamus necessitatibus porro vel.,2023,MPG,76,SV,
46,dolorem,In et vero.,2014,CA,65,HR,
47,explicabo,Culpa aliquid vel.,2006,CA,132,AZ,
48,suscipit,Ex neque molestiae minima autem.,2007,U,95,WS,
49,aut,Iste est quia laudantium iure distinctio et quis est.,2012,UA,150,RO,
50,quis,Quod veritatis inventore aut et eos inventore aspernatur saepe.,2013,TVY7,110,CA,
51,voluptas,Aut aut voluptate placeat sunt atque pariatur velit nihil nam.,2016,MA15,100,CZ,3
52,praesentium,Mollitia ab quis maxime atque voluptate eos dolorum molestias.,2021,_18R,166,ER,8
53,id,Vel doloribus blanditiis quas aut modi.,2011,C,73,FK,
54,saepe,Voluptatum aut voluptate laboriosam.,2017,TVPG,120,SG,5
55,nesciunt,Omnis corporis impedit explicabo eos aut eveniet.,2006,MA15,136,MV,
56,cupiditate,Provident beatae modi rerum non sint accusantium.,2020,AL,139,HR,3
57,laborum,Est dignissimos et quis.,2018,R,180,TW,
58,provident,Et perspiciatis architecto.,2008,_6,166,MZ,
59,voluptate,Amet esse et eos hic veniam.,2022,_12,112,LB,
60,delectus,Vero voluptatem sit eos omnis.,2018,CA,167,GF,
61,sint,Quas non est voluptates deserunt aut.,2003,TVPG,98,MF,8
62,vitae,Ab pariatur quia officiis asperiores nemo odit cumque.,2018,GP,99,CD,1
63,reiciendis,Sed quidem molestiae quas vitae neque qui reprehenderit quidem.,2018,_18R,160,WF,
64,minus,Ipsam possimus ut facilis.,2017,_6,140,GD,
65,debitis,Aliquam dolor iste adipisci facilis rerum ea asperiores aut omnis.,2018,TVG,129,EE,
66,autem,Corporis sunt perspiciatis dolorem facilis animi culpa blanditiis accusamus.,2009,TVPG,108,IN,7
67,dignissimos,Alias cupiditate tempora nam blanditiis debitis unde eius voluptatum.,2015,U,67,CO,
68,consequatur,Incidunt consequatur eos.,2004,CA,94,KG,
69,quia,Qui sint voluptates illum voluptatibus.,2017,M,119,BF,3
70,voluptatum,Sed nobis quo non sit laborum et ratione eaque odio.,2015,_18R,159,GS,7
71,aut,Pariatur architecto rem eius.,2009,PG,158,LC,9
72,id,Impedit consequatur voluptates corporis illo molestias quia.,2017,CA,87,MN,
73,et,Repellendus dignissimos accusantium alias excepturi quisquam dolores sequi.,2012,_6,138,KY,3
74,labore,Cupiditate et ducimus odio.,2014,G,127,GH,
75,maiores,Soluta incidunt in omnis voluptatem est veritatis qui dolorem.,2020,_12A,87,JO,5
76,ut,Voluptatibus nemo rerum.,2022,R21,102,PY,
77,porro,Dolorum dolore reiciendis saepe enim consequatur.,2016,E10plus,86,SS,
78,perspiciatis,Eius sit repellendus.,2021,EC,180,GS,3
79,earum,Explicabo enim sit neque.,2019,EC,160,TL,
80,iure,Et cupiditate quibusdam est provident.,2017,TVPG,167,SD,4
81,ea,Aspernatur corporis enim nesciunt distinctio.,2004,X18,95,ER,5
82,facere,Hic et voluptatem nisi quo et et ex ut.,2018,_6,178,PT,3
83,perspiciatis,Amet et eius odio perferendis aperiam et quos recusandae et.,2014,_18R,158,PF,4
84,dolor,Earum consequatur suscipit suscipit eos impedit.,2010,_6,107,DZ,
85,vitae,Dolore ad eius accusantium.,2008,_12,62,CV,
86,ea,Sapiente quaerat ipsum sunt unde est consectetur.,2018,E10plus,166,GT,
87,quod,Architecto ut magni sit amet et voluptates dolore.,2004,_6,83,KN,10
88,ipsam,Quam consectetur hic facere perspiciatis.,2011,EC,76,GD,
89,sed,Sequi minus reprehenderit occaecati itaque ullam dolor error est.,2015,TVG,166,MY,
90,a,Ut at sunt rem et et earum qui.,2008,TVMA,134,UY,
91,quo,Illo deleniti exercitationem explicabo et sit qui suscipit nihil repellat.,2007,MPG,171,KI,5
92,enim,Placeat nihil sunt voluptas voluptas odio eos vel.,2004,UA,179,BS,6
93,ad,Et iusto autem similique ea illo.,2004,NC17,71,BI,
94,eum,Laborum error et.,2007,TV14,178,UA,5
95,veritatis,Tenetur sunt eum ut.,2012,_18,68,GL,5
96,minima,Debitis sit asperiores in assumenda.,2022,_15,102,TV,
97,et,Molestiae laboriosam voluptatem sit non natus ex tempora.,2010,UA,71,SA,3
98,odio,Vero ipsum ea.,2018,_18R,93,PH,1
99,quas,Consequatur voluptatibus sed est adipisci ipsum enim.,2010,R21,107,FJ,10
100,vel,Eligendi accusamus dolor dolorum repellendus omnis quia facilis accusantium.,2011,G,107,DZ,8
101,odio,Quia error et quae.,2018,PG13,118,SA,
102,aspernatur,Assumenda libero ab maiores necessitatibus.,2014,TVY,120,EG,5
103,distinctio,Corrupti alias aliquid nemo.,2007,EC,99,TV,
104,rem,Totam dolores voluptas.,2014,TVMA,97,TO,3
105,modi,Quas minima non et et non et.,2004,AL,132,GN,
106,beatae,Et blanditiis tempora libero omnis ratione.,2019,C,140,ME,3
107,sint,Eveniet inventore impedit beatae iusto ea earum.,2004,C,135,LB,
108,rerum,Architecto quae voluptatem qui non fugit vero aperiam.,2013,G,159,SZ,8
109,laboriosam,Et sit aliquid repellat tenetur culpa fugit repellendus dolorum.,2007,C,156,ET,7
110,adipisci,Rem impedit blanditiis eligendi est.,2014,TVG,76,GI,7
111,ratione,Dolore distinctio inventore consequuntur et tenetur consectetur.,2022,EC,132,IM,9
112,aut,Ut eos iste consequuntur aut laudantium sit.,2020,X18,95,BW,6
113,numquam,Omnis maxime ea est qui sint aut nam voluptatem nihil.,2007,_18R,85,LK,
114,excepturi,Cumque pariatur saepe doloribus rerum culpa deserunt soluta nesciunt quo.,2011,M,120,BD,9
115,rem,Necessitatibus tenetur molestiae.,2004,_12A,180,LK,
116,sunt,Beatae libero magnam.,2019,_18R,142,GP,8
117,exercitationem,Rem amet aliquam.,2008,U,68,SO,8
118,sit,Et quis iusto mollitia dignissimos modi repellendus quod cumque.,2016,NC17,111,TT,8
119,aliquid,Nesciunt accusamus id in.,2016,S,114,LK,10
120,ipsa,Praesentium est qui a eveniet aut.,2020,_18R,164,ST,
